{
  "$schema": "../../schemas/profile.schema.json",
  "schema_version": "1.0.0",
  "id": "diffusion-prospector-fp8",
  "version": "0.1.0",
  "frozen": false,
  "published": false,
  "display_name": "Diffusion \u00b7 Prospector \u00b7 FP8",
  "summary": "Text to image at 1024 by 1024, sized to fill 64 GB.",
  "category": "diffusion",
  "tier": "prospector",
  "lane": "fp8",
  "requirements": {
    "min_vram_bytes": 68719476736,
    "min_system_ram_bytes": 68719476736,
    "min_disk_bytes": 77309411328,
    "min_driver": "550.54",
    "min_compute_capability": "8.9",
    "architectures": [
      "blackwell",
      "blackwell-gb10",
      "hopper"
    ],
    "platforms": [
      "linux/amd64",
      "linux/arm64"
    ],
    "gpu_count": [
      1,
      2,
      4,
      8
    ],
    "expected_runtime_minutes": 14,
    "expected_download_bytes": 14173392076
  },
  "model": {
    "repository": "black-forest-labs/FLUX.1-schnell",
    "revision": "PENDING",
    "precision": "fp8_e4m3",
    "parameters_b": 14.0,
    "weights_bytes": 14173392076,
    "license": "Apache-2.0",
    "files": []
  },
  "runtime": {
    "name": "diffusers",
    "version": "0.39.0",
    "harness": "diffusion-adapter",
    "harness_version": "0.1.0",
    "server_ready_timeout_s": 900,
    "flags": {
      "torch_dtype": "float8_e4m3fn",
      "enable_attention_slicing": false,
      "enable_vae_slicing": false,
      "enable_model_cpu_offload": false,
      "torch_compile": false
    },
    "flag_overrides_allowed": []
  },
  "workloads": [
    {
      "id": "t2i_1024",
      "kind": "diffusion_t2i",
      "required_for_rank": true,
      "warmup_requests": 1,
      "measured_requests": 12,
      "timeout_s": 1800,
      "config": {
        "width": 1024,
        "height": 1024,
        "steps": 30,
        "scheduler": "DPMSolverMultistep",
        "guidance_scale": 5.0,
        "batch_size": 1,
        "prompt_file": "assets/diffusion/prompts.json",
        "seeds": [
          1101,
          2202,
          3303,
          4404
        ],
        "vae_precision": "fp16",
        "attention": "sdpa",
        "cpu_offload": false,
        "compile": false
      }
    }
  ],
  "ranking": {
    "metric": "seconds_per_step_s",
    "unit": "s/step",
    "direction": "lower_is_better",
    "source_workload": "t2i_1024",
    "secondary": [
      {
        "metric": "throughput_img_min",
        "label": "Images / min",
        "unit": "img/min",
        "direction": "higher_is_better",
        "source_workload": "t2i_1024"
      },
      {
        "metric": "generation_p50_s",
        "label": "Per image p50",
        "unit": "s",
        "direction": "lower_is_better",
        "source_workload": "t2i_1024"
      },
      {
        "metric": "generation_p95_s",
        "label": "Per image p95",
        "unit": "s",
        "direction": "lower_is_better",
        "source_workload": "t2i_1024"
      },
      {
        "metric": "energy_per_image_j",
        "label": "Energy / image",
        "unit": "J",
        "direction": "lower_is_better",
        "source_workload": "t2i_1024"
      },
      {
        "metric": "model_load_s",
        "label": "Pipeline load",
        "unit": "s",
        "direction": "lower_is_better",
        "source_workload": "t2i_1024"
      }
    ],
    "gates": [
      {
        "metric": "error_ratio",
        "comparator": "lte",
        "value": 0.0,
        "source_workload": "t2i_1024",
        "reason": "Any failed generation invalidates the measurement."
      },
      {
        "metric": "offload_ratio",
        "comparator": "lte",
        "value": 0.0,
        "source_workload": "t2i_1024",
        "reason": "CPU offload turns this into a system benchmark and is not comparable."
      }
    ]
  },
  "validation": {
    "required_artifacts": [
      "raw_records",
      "telemetry",
      "system_report",
      "adapter_log",
      "sample_image"
    ],
    "telemetry_interval_ms": 100,
    "min_telemetry_coverage_pct": 99.0,
    "metric_recompute_tolerance_pct": 0.5,
    "max_repeat_cv_pct": 3.0,
    "plausibility": {
      "seconds_per_step_s": {
        "min": 0.001,
        "max": 120
      },
      "throughput_img_min": {
        "min": 0.01,
        "max": 600
      },
      "vram_peak_bytes": {
        "min": 1073741824,
        "max": 206158430208
      },
      "power_avg_w": {
        "min": 5,
        "max": 1200
      }
    }
  },
  "notes": [
    "This profile is a release candidate. The runtime is pinned. The model revision is not final. This leaderboard is provisional.",
    "Ranked on seconds for each step. That value does not change if the resolution or the step count changes. Images for each minute comes from it.",
    "Diffusion is compute-bound. The LLM profiles are bandwidth-bound. This is deliberate.",
    "CPU offload is off, and a gate enforces it. A run that offloads measures the host as well as the GPU. LocalMax publishes it but does not rank it.",
    "This tier accepts a cluster. LocalMax computes the tier from the total VRAM across all nodes, so eight DGX Sparks are one Prospector system. It ranks each GPU count and each parallelism mode separately, because the network fabric changes the result."
  ]
}
